{"$defs":{"recursive_semantic_value":{"anyOf":[{"type":"null"},{"type":"boolean"},{"type":"number"},{"type":"string"},{"items":{"$ref":"#/$defs/recursive_semantic_value"},"type":"array"},{"additionalProperties":{"$ref":"#/$defs/recursive_semantic_value"},"properties":{"evidence_locator":{"$ref":"#/$defs/safe_evidence_locator"},"safe_locator":{"$ref":"#/$defs/safe_evidence_locator"}},"propertyNames":{"not":{"anyOf":[{"enum":["canonical_ref","project_ref","scene_ref","shot_ref","artifact_ref","ref","digest","timestamp","idempotency","expected_version","accepted","rejected","frozen","delivered","budget","budget_receipt","provider","provider_payload","model","credential","credentials","raw_prompt","hidden_prompt","tool_call"]},{"pattern":"(^|[_ .-])[Rr][Ee][Ff]$"}]}},"type":"object"}]},"safe_evidence_locator":{"allOf":[{"pattern":"^evidence://[^\\r\\n]*$"},{"not":{"pattern":"[Ss][Hh][Aa]256:|[Pp][Rr][Oo][Mm][Pp][Tt][Rr][Ee][Pp][Oo]://"}}],"maxLength":2048,"type":"string"}},"$id":"https://schemas.yeisme.dev/promptrepo/ai-film-multi-profile-production/shot-prompt-semantic-output-v1","$schema":"https://json-schema.org/draft/2020-12/schema","additionalProperties":false,"allOf":[{"$ref":"#/$defs/recursive_semantic_value"}],"properties":{"action_timeline":{"items":{"additionalProperties":true,"maxProperties":32,"type":"object"},"maxItems":64,"type":"array"},"audio_role":{"additionalProperties":true,"maxProperties":32,"type":"object"},"bounded_negative_constraints":{"items":{"additionalProperties":true,"maxProperties":32,"type":"object"},"maxItems":64,"type":"array"},"camera_optics":{"additionalProperties":true,"maxProperties":32,"type":"object"},"fallback_coverage":{"items":{"additionalProperties":true,"maxProperties":32,"type":"object"},"maxItems":64,"type":"array"},"findings":{"items":{"additionalProperties":false,"properties":{"code":{"maxLength":128,"minLength":2,"type":"string"},"evidence":{"maxLength":2048,"minLength":1,"type":"string"},"repair":{"maxLength":2048,"minLength":1,"type":"string"},"severity":{"enum":["blocking","high","medium","low","unknown"]}},"required":["code","severity","evidence","repair"],"type":"object"},"maxItems":32,"type":"array"},"first_frame_lock":{"additionalProperties":true,"maxProperties":32,"type":"object"},"lighting":{"additionalProperties":true,"maxProperties":32,"type":"object"},"observable_performance":{"additionalProperties":true,"maxProperties":32,"type":"object"},"physics":{"additionalProperties":true,"maxProperties":32,"type":"object"},"positive_continuity_locks":{"additionalProperties":true,"maxProperties":32,"type":"object"},"profile_checks":{"items":{"additionalProperties":true,"maxProperties":32,"type":"object"},"maxItems":64,"type":"array"},"uncertainty":{"additionalProperties":{"maxLength":2048,"type":"string"},"maxProperties":16,"type":"object"}},"propertyNames":{"not":{"enum":["canonical_ref","project_ref","scene_ref","shot_ref","artifact_ref","digest","timestamp","idempotency","expected_version","accepted","rejected","frozen","delivered","budget","budget_receipt","provider","provider_payload","model","credential","raw_prompt","hidden_prompt","tool_call"]}},"required":["first_frame_lock","camera_optics","action_timeline","observable_performance","physics","lighting","audio_role","positive_continuity_locks","bounded_negative_constraints","profile_checks","findings","fallback_coverage","uncertainty"],"type":"object"}