{"action_timeline":[{"action":"look","seconds":"0-2"}],"audio_role":{"dialogue":"none"},"bounded_negative_constraints":[{"risk":"extra character"}],"camera_optics":{"movement":"static"},"fallback_coverage":[{"coverage":"prop insert"}],"findings":[],"first_frame_lock":{"characters":2,"screen_direction":"locked"},"lighting":{"source":"motivated"},"observable_performance":{"breath":"held","gaze":"toward prop"},"physics":{"weight_transfer":"stable"},"positive_continuity_locks":{"identity":"locked"},"profile_checks":[{"check":"hands readable"}],"uncertainty":{"evidence":"fixture-only"}}